{
  "schemaVersion": 1,
  "catalogVersion": "0.1.0",
  "generatedAt": "2026-10-28",
  "entries": [
    {
      "id": "anthropics/skills#skills/frontend-design",
      "name": "frontend-design",
      "description": "Guidance for distinctive, intentional visual design when building new UI or reshaping an existing one. Helps with aesthetic direction, typography, and making choices that don't read as templated defaults.",
      "source": {
        "provider": "github",
        "owner": "anthropics",
        "repository": "skills",
        "skillPath": "skills/frontend-design",
        "commit": "ca45fc496a3436251f191354091d557da31c15b5"
      },
      "categories": [
        "web"
      ],
      "stack": [
        "web"
      ],
      "requiresAnyStack": [],
      "tasks": [
        "ui-design"
      ],
      "prerequisites": [],
      "agents": {
        "claude-code": "portable",
        "codex": "portable"
      },
      "license": {
        "spdx": "Apache-2.0",
        "scope": "skill",
        "evidencePath": "skills/frontend-design/LICENSE.txt"
      },
      "payload": {
        "files": 2,
        "bytes": 19564,
        "unsupportedFiles": []
      },
      "targetSpecificFrontmatter": [],
      "verifiedAt": "2026-10-28"
    },
    {
      "id": "anthropics/skills#skills/mcp-builder",
      "name": "mcp-builder",
      "description": "Guide for creating high-quality MCP (Model Context Protocol) servers that enable LLMs to interact with external services through well-designed tools. Use when building MCP servers to integrate external APIs or services, whether in Python (FastMCP) or Node/TypeScript (MCP SDK).",
      "source": {
        "provider": "github",
        "owner": "anthropics",
        "repository": "skills",
        "skillPath": "skills/mcp-builder",
        "commit": "ca45fc496a3436251f191354091d557da31c15b5"
      },
      "categories": [
        "ai"
      ],
      "stack": [
        "ai"
      ],
      "requiresAnyStack": [],
      "tasks": [
        "mcp",
        "ai-integration"
      ],
      "prerequisites": [
        "Python or Node.js MCP SDK"
      ],
      "agents": {
        "claude-code": "portable",
        "codex": "portable"
      },
      "license": {
        "spdx": "Apache-2.0",
        "scope": "skill",
        "evidencePath": "skills/mcp-builder/LICENSE.txt"
      },
      "payload": {
        "files": 11,
        "bytes": 159159,
        "unsupportedFiles": []
      },
      "targetSpecificFrontmatter": [],
      "verifiedAt": "2026-10-28"
    },
    {
      "id": "anthropics/skills#skills/webapp-testing",
      "name": "webapp-testing",
      "description": "Toolkit for interacting with and testing local web applications using Playwright. Supports verifying frontend functionality, debugging UI behavior, capturing browser screenshots, and viewing browser logs.",
      "source": {
        "provider": "github",
        "owner": "anthropics",
        "repository": "skills",
        "skillPath": "skills/webapp-testing",
        "commit": "ca45fc496a3436251f191354091d557da31c15b5"
      },
      "categories": [
        "web",
        "testing"
      ],
      "stack": [
        "web"
      ],
      "requiresAnyStack": [],
      "tasks": [
        "browser-testing",
        "testing",
        "debugging"
      ],
      "prerequisites": [
        "Python and Playwright for bundled helper scripts"
      ],
      "agents": {
        "claude-code": "portable",
        "codex": "portable"
      },
      "license": {
        "spdx": "Apache-2.0",
        "scope": "skill",
        "evidencePath": "skills/webapp-testing/LICENSE.txt"
      },
      "payload": {
        "files": 6,
        "bytes": 22394,
        "unsupportedFiles": []
      },
      "targetSpecificFrontmatter": [],
      "verifiedAt": "2026-10-28"
    },
    {
      "id": "avdlee/swift-concurrency-agent-skill#skills/swift-concurrency",
      "name": "swift-concurrency",
      "description": "Diagnose Swift Concurrency issues, refactor callback-based code to async/await, and guide Swift 6 migration when working with tasks, actors, @MainActor, Sendable, data races, thread safety, or concurrency-related compiler and linter warnings.",
      "source": {
        "provider": "github",
        "owner": "AvdLee",
        "repository": "Swift-Concurrency-Agent-Skill",
        "skillPath": "skills/swift-concurrency",
        "commit": "d5770817d2622e1585b1f7eaebc791a9cb0959c8"
      },
      "categories": [
        "ios"
      ],
      "stack": [
        "swift"
      ],
      "requiresAnyStack": [
        "swift",
        "ios"
      ],
      "tasks": [
        "concurrency"
      ],
      "prerequisites": [],
      "agents": {
        "claude-code": "portable",
        "codex": "portable"
      },
      "license": {
        "spdx": "MIT",
        "scope": "repository",
        "evidencePath": "LICENSE"
      },
      "payload": {
        "files": 20,
        "bytes": 272953,
        "unsupportedFiles": []
      },
      "targetSpecificFrontmatter": [],
      "verifiedAt": "2026-10-28"
    },
    {
      "id": "callstackincubator/agent-skills#skills/upgrading-react-native",
      "name": "upgrading-react-native",
      "description": "Upgrades React Native apps to newer versions by applying rn-diff-purge template diffs, updating package.json dependencies, migrating native iOS and Android configuration, resolving CocoaPods and Gradle changes, and handling breaking API updates. Use when upgrading React Native, bumping RN version, updating from RN 0.x to 0.y, or migrating Expo SDK alongside a React Native upgrade.",
      "source": {
        "provider": "github",
        "owner": "callstackincubator",
        "repository": "agent-skills",
        "skillPath": "skills/upgrading-react-native",
        "commit": "59e9d17446a248b21d86f078fcd0bd2d36db1ca4"
      },
      "categories": [
        "mobile"
      ],
      "stack": [
        "react-native"
      ],
      "requiresAnyStack": [
        "react-native"
      ],
      "tasks": [
        "upgrade"
      ],
      "prerequisites": [
        "React Native project with iOS/Android native folders"
      ],
      "agents": {
        "claude-code": "portable",
        "codex": "portable"
      },
      "license": {
        "spdx": "MIT",
        "scope": "repository",
        "evidencePath": "LICENSE"
      },
      "payload": {
        "files": 9,
        "bytes": 23837,
        "unsupportedFiles": []
      },
      "targetSpecificFrontmatter": [],
      "verifiedAt": "2026-10-28"
    },
    {
      "id": "cloudflare/skills#skills/agents-sdk",
      "name": "agents-sdk",
      "description": "Build, debug, or review Cloudflare Agents SDK applications using the agents package.",
      "source": {
        "provider": "github",
        "owner": "cloudflare",
        "repository": "skills",
        "skillPath": "skills/agents-sdk",
        "commit": "49a31e0b3229ccdffe4944be9c61bc7481d1d432"
      },
      "categories": [
        "ai",
        "backend"
      ],
      "stack": [
        "ai",
        "cloudflare"
      ],
      "requiresAnyStack": [],
      "tasks": [
        "ai-integration",
        "cloud-workers"
      ],
      "prerequisites": [
        "Cloudflare Agents SDK (agents package)"
      ],
      "agents": {
        "claude-code": "portable",
        "codex": "portable"
      },
      "license": {
        "spdx": "Apache-2.0",
        "scope": "repository",
        "evidencePath": "LICENSE"
      },
      "payload": {
        "files": 21,
        "bytes": 50553,
        "unsupportedFiles": []
      },
      "targetSpecificFrontmatter": [],
      "verifiedAt": "2026-10-28"
    },
    {
      "id": "cloudflare/skills#skills/nextjs-on-cloudflare",
      "name": "nextjs-on-cloudflare",
      "description": "Build, migrate, and deploy Next.js apps on Cloudflare Workers with vinext. Use when starting a Next.js project on Cloudflare, moving an existing app to Workers, choosing between vinext and OpenNext, or setting up vinext for Workers. For setup, migration, or deployment, install vinext's upstream skills with `npx skills add cloudflare/vinext` if missing, then read and follow the applicable skill and docs.",
      "source": {
        "provider": "github",
        "owner": "cloudflare",
        "repository": "skills",
        "skillPath": "skills/nextjs-on-cloudflare",
        "commit": "49a31e0b3229ccdffe4944be9c61bc7481d1d432"
      },
      "categories": [
        "web",
        "infra"
      ],
      "stack": [
        "nextjs"
      ],
      "requiresAnyStack": [
        "nextjs"
      ],
      "tasks": [
        "deployment",
        "cloud-workers"
      ],
      "prerequisites": [
        "Cloudflare account; vinext upstream skills (installed separately)"
      ],
      "agents": {
        "claude-code": "portable",
        "codex": "portable"
      },
      "license": {
        "spdx": "Apache-2.0",
        "scope": "repository",
        "evidencePath": "LICENSE"
      },
      "payload": {
        "files": 2,
        "bytes": 5715,
        "unsupportedFiles": []
      },
      "targetSpecificFrontmatter": [],
      "verifiedAt": "2026-10-28"
    },
    {
      "id": "cloudflare/skills#skills/web-perf",
      "name": "web-perf",
      "description": "Audit, diagnose, or optimize website loading and interaction performance, Core Web Vitals, and Lighthouse performance scores.",
      "source": {
        "provider": "github",
        "owner": "cloudflare",
        "repository": "skills",
        "skillPath": "skills/web-perf",
        "commit": "49a31e0b3229ccdffe4944be9c61bc7481d1d432"
      },
      "categories": [
        "web"
      ],
      "stack": [
        "web"
      ],
      "requiresAnyStack": [],
      "tasks": [
        "performance"
      ],
      "prerequisites": [],
      "agents": {
        "claude-code": "portable",
        "codex": "portable"
      },
      "license": {
        "spdx": "Apache-2.0",
        "scope": "repository",